{"schema_version":"mindclade.evaluation-snapshot/v1","kind":"EvaluationSnapshot","metadata":{"uid":"evaluation-001","created_at":"2026-08-31T12:00:00Z","producer":"evaluation-service","classification":"INTERNAL"},"spec":{"subject":{"uri":"artifacts/checkpoints/001","digest":"sha256:aaaaaaaaaaaaaaaaaaaaaaaaaaaaaaaaaaaaaaaaaaaaaaaaaaaaaaaaaaaaaaaa","media_type":"application/schema+json","schema_version":"mindclade.checkpoint-manifest/v1"},"dataset":{"uri":"artifacts/datasets/test-001","digest":"sha256:bbbbbbbbbbbbbbbbbbbbbbbbbbbbbbbbbbbbbbbbbbbbbbbbbbbbbbbbbbbbbbbb","media_type":"application/schema+json","schema_version":"mindclade.dataset-manifest/v1"},"metrics":{"uri":"artifacts/evaluations/001/metrics","digest":"sha256:cccccccccccccccccccccccccccccccccccccccccccccccccccccccccccccccc","media_type":"application/json","schema_version":"mindclade.evaluation-metrics/v1"},"subject_verified":true,"evaluation_policy_digest":"sha256:dddddddddddddddddddddddddddddddddddddddddddddddddddddddddddddddd","intended_use":"NON_CLINICAL_RESEARCH"},"lineage":[{"uri":"artifacts/checkpoints/001","digest":"sha256:aaaaaaaaaaaaaaaaaaaaaaaaaaaaaaaaaaaaaaaaaaaaaaaaaaaaaaaaaaaaaaaa","media_type":"application/schema+json","schema_version":"mindclade.checkpoint-manifest/v1"},{"uri":"artifacts/datasets/test-001","digest":"sha256:bbbbbbbbbbbbbbbbbbbbbbbbbbbbbbbbbbbbbbbbbbbbbbbbbbbbbbbbbbbbbbbb","media_type":"application/schema+json","schema_version":"mindclade.dataset-manifest/v1"}],"integrity":{"payload_digest":"sha256:eeeeeeeeeeeeeeeeeeeeeeeeeeeeeeeeeeeeeeeeeeeeeeeeeeeeeeeeeeeeeeee","evidence":[]}}
